Title,URL,Author,Upvotes,Comments,Created UTC
Police desperately trying to get women arrested for not wanting a kid.,https://redd.it/141pd4v,MisterFyre,459,48,2023-06-05
man tried to escape police while handcuffed 🫠,https://redd.it/144iuxy,Crazy-Restaurant6259,298,13,2023-06-08
Committing a crime and then booping a police car,https://redd.it/145975s,AristonD,335,16,2023-06-09
Police Officer Fired Over Posting Racist Memes Just 2 Days After Being Sworn-In,https://redd.it/1466qsz,blackdutch1,14221,759,2023-06-10
"""Why don't people trust police?""",https://redd.it/14bypi7,scandr0id,14748,2667,2023-06-17
"Girl tries to blame the police (for brutality) and gets caught on video doing this. Jujuy, Argentina.",https://redd.it/14fq7ws,JohnCent90,1056,65,2023-06-22
Calling the police for not speaking English,https://redd.it/14j8a8l,Aki008035,164,23,2023-06-26
Kentucky woman shoots Uber driver in back of the head because she though she was being kidnapped to Mexico.,https://redd.it/14jiz9g,Fabulous-Pin9191,7431,1247,2023-06-26
"my mom called the police on a man today for using a ""counterfeit"" $5 bill because she doesn't remember what $5 bills looked like 20 years ago.",https://redd.it/14kipd5,big-guy-small-car,3368,378,2023-06-27
Politician Arrested for Keying a Car Over Bumper Sticker,https://redd.it/14ko6ga,Unusual_Fishing9348,11016,844,2023-06-27
"Remember the POS who threatened a couple with a rock, mocked a homeless man, and abused a cat? Yesterday, he was finally arrested for making terrorist threats.",https://redd.it/14pqwkx,WestProcess2,17148,713,2023-07-03
"A Californian Veteran who was left paralyzed after use of force by police officers, has been awarded a $20 million settlement.",https://redd.it/14ye8tg,Gamer4Lyph,9868,492,2023-07-13
No good deed goes unpunished,https://redd.it/15ho006,Ada_BX,8846,250,2023-08-04
Posted by my local police department,https://redd.it/15m16db,prostitutionwhorga,170,17,2023-08-09
Malaysia's fashion police is very real,https://redd.it/15n6vg7,cambeiu,846,160,2023-08-10
The response I got from my father when I told him someone stole my car 🤦🏼‍♂️,https://redd.it/15qyp13,Seahawks1991,13734,1793,2023-08-14
Anyone calls for backup? Oh wait...,https://redd.it/15s4x7b,Possible-Vanilla7403,3064,566,2023-08-15
"""To combat racism, stop calling the police""",https://redd.it/161wrd1,I_notice_patterns,23,33,2023-08-26
"Dallas police officers seen laughing in bodycam video after preventing a disabled Army vet from using the bathroom, resulting the Army vet to urinate on himself.",https://redd.it/16533ma,HonorableGilgamesh,4878,521,2023-08-30
Police car blocks wheelchair ramp,https://redd.it/16fuv6q,Kaylee865,29,8,2023-09-11
"Martin Bryant murdered 35 people and injured 23 others in a mass shooting in the Port Arthur massacre in 1996, one of the world's deadliest shooting sprees. After months of denying, he unexpectedly admitted being guilty thinking the police stopped recording.",https://redd.it/16fsdsz,MotherLoveBone41,1977,213,2023-09-11
Period of police training in western countries,https://redd.it/16ftni4,Esme_ZL,1834,502,2023-09-11
Police need to learn to keep their feelings in check.,https://redd.it/16hxq2c,Silent_Assasin14,11568,1942,2023-09-13
Teens running over people for fun,https://redd.it/16l0fgw,Away_Needleworker6,4413,827,2023-09-17
Life in prison!,https://redd.it/16lyhop,Suspicious_County_24,6551,1147,2023-09-18
They loved him so much the police personally invited him to the Police Station,https://redd.it/16oz2yh,Aki008035,283,39,2023-09-22
The police don't care about your shitty posts,https://redd.it/16t3mxz,Freshman_01134,72,22,2023-09-26
Lol...Shes free to do what she likes.....,https://redd.it/173y3lu,Solopeerless,5456,609,2023-10-09
The person who posted this was jailed before for 28 months after sending explicit messages to an undercover police officer who he thought was a 14-year-old boy.,https://redd.it/17qin9g,mercurypuppy,1052,433,2023-11-08
"Ladies and Gentlies, the drugs my cleaning woman reported to the police",https://redd.it/17wslay,Pharalynx,69267,6132,2023-11-16
Police compliments guy on guns before he kills someone,https://redd.it/17ybdn1,Many_Panic8570,33522,1769,2023-11-18
Australian Police Seize Toy Guns,https://redd.it/184tguo,DecoyAsian,0,6,2023-11-27
Stolen KIA fleeing from police crashed right next to our university…,https://redd.it/18d3h9k,mcb7799,58,40,2023-12-07
I like this better than most American police stories,https://redd.it/18dwis9,MeltedAcreage,187,9,2023-12-08
Ever heard of advanced biology?,https://redd.it/18fiqeg,Ch0pperActual,6772,1539,2023-12-11
This is so dumb. He's only 10.,https://redd.it/18i2qpt,Visqo,36690,3118,2023-12-14
An 82-year-old woman can't pay her trash bill. The police came to arrest her,https://redd.it/18ltn0y,Lilliana_Donatella,101,39,2023-12-19
"Arrested for ""creating a disturbance"" after a police car crashed into his bar",https://redd.it/18nsb3b,Jedimaster1134,31833,1214,2023-12-21
