Title,URL,Author,Upvotes,Comments,Created UTC
"Its ok Ma'am, We're the cyber police! (x/post from cringepics)",https://redd.it/1vm7a9,my_sisters_a_whore,1694,84,2014-01-19
"My hometown, a real police report.",https://redd.it/3oovau,KenBanner21,1096,44,2015-10-14
''Nobody will recognise me using a stolen creditcard this way!'' - Dutch police just released a picture of this guy..,https://redd.it/4au99x,Maklo_Never_Forget,3881,110,2016-03-17
The cyber police,https://redd.it/5bezub,bigbloodymess69,7355,199,2016-11-06
Grammar Police Fails .,https://redd.it/5la9mg,AceDoged,13914,327,2016-12-31
Local police bring some sass with battering ram,https://redd.it/5pw580,Gypsyarados,10505,630,2017-01-24
The local police Twitter always gets me.,https://redd.it/89n4st,glasseyebill,18829,226,2018-04-04
Lady tries to steal a police car,https://redd.it/9qjto6,SSpSpoSpouSpout,3505,98,2018-10-23
This pedophile was identified when the police realised that they could simply undo the ‘swirl’ effect that he was using to hide his identity online,https://redd.it/aor5xf,x__________________-,23958,455,2019-02-09
How to hide from the police like a pro,https://redd.it/ddmr8u,cd4053b,2684,42,2019-10-05
Idiot police thinks he’s slick,https://redd.it/diowjr,EatGarb,2250,58,2019-10-16
Police car blocks wheelchair ramp,https://redd.it/euo2wm,anoobsearcher,7863,141,2020-01-27
This idiot is talking about the terrorist UK police killed today.,https://redd.it/exsuvo,lemonsarethekey,3404,105,2020-02-02
Ah yes they will never suspect this as an police vehicle,https://redd.it/f15th5,numbershit,51711,541,2020-02-09
Police are involved,https://redd.it/f1qmcr,anoobsearcher,17569,451,2020-02-10
Police chases the wrong guy because of his outfit.,https://redd.it/fxd79s,theriffguy,1289,68,2020-04-08
Amazing police here,https://redd.it/gbyoie,Galactic-Lord,1685,25,2020-05-02
This women’s attempt in making the police look violent,https://redd.it/gfkd51,Ghulam_Jewel,3736,179,2020-05-08
Yes because a black police officer would have been a farfetched concept to some people,https://redd.it/ggxr5f,DaMain-Man,89839,1866,2020-05-10
"Hey police, what the fuck",https://redd.it/gycda0,Deathbysnusnubooboo,2469,111,2020-06-07
The police at it again,https://redd.it/gyqc64,lol62056,1342,23,2020-06-08
"Time to call the police, Karen",https://redd.it/h0pbx8,jigsawmap,4805,83,2020-06-11
Period of police training in western countries,https://redd.it/harngh,surfinThruLyfe,75277,3620,2020-06-17
I updated the Police Training image for accuracy,https://redd.it/hbg1el,lazerwolf987,1149,66,2020-06-18
So you agree? You agree that police brutality IS an issue?,https://redd.it/hsd7wy,i-like-to-be-wooshed,1130,83,2020-07-16
The American police system has so many flaws.,https://redd.it/j96fel,Parvak07,3536,167,2020-10-11
"Thief steals bike, salutes at CCTV before getting busted by the police and escorted back to the same camera.",https://redd.it/js5hnf,Revelator_9o4,4937,38,2020-11-11
TJs employees doing a better job than the Capitol Police,https://redd.it/ktlczj,Powerfulwoman20,4933,42,2021-01-09
When not even police units enforce mask wearing,https://redd.it/lguayi,d4wnn,325,108,2021-02-10
What can go wrong with the police?,https://redd.it/li8xn2,m3antar,762,66,2021-02-12
Police really had the nerve to fine her,https://redd.it/mddaej,Allstarhit,8459,229,2021-03-26
Just a reminder that police aren't supposed to kill people even if they are guilty,https://redd.it/mt6ns0,jim_par,10421,425,2021-04-18
Having police officers is necessary but not necessarily the Dreck Chauvin,https://redd.it/mw1ukq,Mary-Trustyn-Wise,1152,45,2021-04-22
During a blackout people in LA called the police because they were concerned about the weird lights in the sky.,https://redd.it/oqq2wf,WonderfulYoghurt3197,9814,213,2021-07-24
Gives cringeworthy speech and acts heroic until the police turn up during anti lockdown protest,https://redd.it/p940yl,faiersy101,1415,91,2021-08-22
Anti-vax idiots in Australia go head to head with the police about mandates,https://redd.it/pt4yyx,DaFunkJunkie,1588,466,2021-09-22
Maybe this is why a President shouldn’t be telling Police to “rough up” suspects a little bit,https://redd.it/pxtakb,Utsutsumujuru,48942,1440,2021-09-29
Police draw guns on a stormtrooper with a fake blaster.,https://redd.it/q1jkm5,MyCoddledMind,23034,1492,2021-10-05
Idiot pretends to be a police officer,https://redd.it/q5kx65,meAnDdbOis_,772,56,2021-10-11
Police pulls over Tesla driver over the center console,https://redd.it/q76lve,tyw7,12313,670,2021-10-13
Let's throw some beer at the military police,https://redd.it/q70nef,shayanisanidiot,640,168,2021-10-13
"Seattle Police, discharged for noncompliance with the vaccine mandate, turn in their boots at the city hall rather than do the right thing to protect their community",https://redd.it/qbrf7x,DaFunkJunkie,15252,3986,2021-10-20
White neighbors call police on black family claiming their funeral limousine is blocking their driveway.,https://redd.it/qcr3yh,NNoppee,6552,463,2021-10-21
Police officers protesting vaccine mandates with 'Do Not Comply' signs,https://redd.it/qjvetj,Smartercow,38127,3408,2021-10-31
Assaulting a police officer for fun,https://redd.it/qmhuua,sabin_72246,536,35,2021-11-04
The Police Fatally Shot a Young Girl And Two Teenagers Are Charged With The Murder.,https://redd.it/qw0tyl,RavenousFox1985,1121,253,2021-11-17
It's not what you think dear police officer,https://redd.it/qxzfew,hushitsu,7343,150,2021-11-20
Police officer “detains” guy after getting in his face,https://redd.it/r8a4ea,HiItsLust,74788,5631,2021-12-03
Police roll up on black woman studying in a park to inform her she isn’t allowed to study there next week,https://redd.it/raghe6,HiItsLust,29665,4174,2021-12-06
Hello police!,https://redd.it/rby34i,hushitsu,36646,581,2021-12-08
Road Rage versus an Unmarked Russian Police Force.,https://redd.it/rootvc,feelingood41,267,67,2021-12-26
Police officer intentionally damages car with door while performing a search.,https://redd.it/ru2q6f,S-Quidmonster,84871,3914,2022-01-02
Police try to search a man's property without a search warrant. That smirk tho...,https://redd.it/s0dqct,spyrg,21432,1542,2022-01-10
Seattle Police Department making it illegal to help the homeless,https://redd.it/s6m4c5,Mr__O__,633,80,2022-01-18
Police officer pulls over sheriff for speeding,https://redd.it/s8hyus,morallyirresponsible,10255,737,2022-01-20
Arresting the Police and then calling the Police to take the arrested Police officers into custody,https://redd.it/s9if02,891R,2140,448,2022-01-21
Police fail,https://redd.it/si03ip,Neurotic__,5570,55,2022-02-01
Lazy police work,https://redd.it/smsvwe,Smartercow,1366,116,2022-02-07
Gazpacho police 👮‍♀️! Make better choices America,https://redd.it/sp78vx,creatingastorm,1957,169,2022-02-10
One time a man walked into a police station with an assault rifle & tactical gear along his friends because of an earlier traffic stop. It went about as well as you’d expect.,https://redd.it/stm9rk,thepositivepandemic,28128,2098,2022-02-16
Police arrest only black kid in fight while white kid is politely seated,https://redd.it/stt0u2,CaulkADewDillDue,27349,2946,2022-02-16
This is hung up in my local police station,https://redd.it/swmjl6,NatesRedditAccount2,921,160,2022-02-19
When the Police (it looks like Israeli) try to arrest a Teenager With Special Needs,https://redd.it/sy6x9j,hesseh,1632,397,2022-02-21
"Bank of America calls police on 'Black Panther' director Ryan Coogler after attempting to withdraw $12,000 from his own account",https://redd.it/tasj8i,kobeintheclutch,133261,11903,2022-03-10
Police arresting protester with a blank sheet of paper in Nizhny Novgorod,https://redd.it/td4i5j,Molecule98,1081,44,2022-03-13
Black Schoolgirl Subjected to ‘Horrific’ Strip-Search by Police,https://redd.it/tiqohi,Worried_Protection48,3603,231,2022-03-20
What does the police thinking?,https://redd.it/tymqgl,Digital_Rooftop,337,35,2022-04-07
how would the police react lol,https://redd.it/u212uu,airtoairnuke,1417,324,2022-04-12
Taunting the police,https://redd.it/u9mf3b,johnnychan81,226,88,2022-04-22
Police detained protesters because they invisible anti-government posters 😉,https://redd.it/ugzv8l,Peer-press-sure,812,54,2022-05-02
13 year old girl goes to police in India to report r/pe; police r/pe her as well. Biggest facepalm.,https://redd.it/uils1p,VividPlane1455,169,89,2022-05-05
police man caught on a fence,https://redd.it/uplnbg,ManufacturerNo7111,14339,859,2022-05-14
Undercover NYPD police officer punches man and then gets punched in return (This happened in New York),https://redd.it/uukyed,Davidtry567,407,205,2022-05-21
Weren't there multiple police outside of the latest mass shootings?,https://redd.it/uyepsa,ilikesaucy,539,729,2022-05-26
The police will let your kids get slaugthered because you are mean to them,https://redd.it/uykniw,gusfring88,262,129,2022-05-26
Angeli Gomez had to jump the fence and recused her children while police stood outside,https://redd.it/uzm4k7,NineteenEighty9,1637,374,2022-05-28
The Las Vegas Metropolitan Police Dept completely disregards the actual written law and literally just harasses artists for no reason.,https://redd.it/v5ksy9,RamonitaValley,1605,71,2022-06-05
Russian driver stopped by police after exceeding the speed limit in Ukraine. Tries to talk his way out of it by pretending to only speak English. Doesn’t realize that police officers can speak English too…,https://redd.it/vavk18,waitingforthesun92,10083,189,2022-06-12
Police amiright,https://redd.it/veo1qt,Disastrous-Scheme-57,1229,77,2022-06-17
To impersonate a police officer,https://redd.it/vf4emi,Ivesy_,87611,1821,2022-06-18
"Teen: ""Give me my bag"" Police Officer *finds a gun*",https://redd.it/vua2vo,GTswef,1201,81,2022-07-08
This is a time-lapse of the 67 minutes Ulvade police sat in the hallway and listened to children getting slaughtered,https://redd.it/vxsq52,Capedbaldy474,1743,486,2022-07-13
"Armed stalker was killed by cops in a shootout after shooting up a woman’s flat, protestors protest calling his death ‘police brutality’ (now with sound!)",https://redd.it/w1s8pw,u_e_s_i,8116,1321,2022-07-18
Entitled racist Karen gets pulled over for trying to record police while driving,https://redd.it/waa72c,Shadow474747,16003,2279,2022-07-28
"A Seattle woman driving through her neighborhood saw a black man enter his home so pulled over and called the police on him. “If you guys have a lease, I’d just like to see the lease.”",https://redd.it/wh9knf,knownothingwiseguy,65789,5364,2022-08-05
"""Police kill man in pre-criminal phase of his life""",https://redd.it/wjz3v9,Capedbaldy474,13395,165,2022-08-09
Sooooo you're saying Abolish the Police?,https://redd.it/wjtl7x,ProgressiveSnark2,1203,76,2022-08-09
"Off duty police officer pulls gun on gas station patron he suspects of shoplifting, turns out he was dead wrong.",https://redd.it/wmnxi3,TwisBeats,79432,7312,2022-08-12
An Upset McDonald's Customer Calls 911 Over Cold Fries and Is Arrested After Police Discover He’s Wanted for Murder.,https://redd.it/wp26pg,Vexiune,10636,756,2022-08-15
"Found a wallet, turned it in at the nearest police station...",https://redd.it/wyczwt,chibosader,4513,312,2022-08-26
Hmm threatening to destroy police that will work out well,https://redd.it/x04d02,Shadow474747,533,21,2022-08-28
Police tried to cross the street but there was a Truck coming...What a save from the Truck driver,https://redd.it/x02dgp,DoseClips,1095,77,2022-08-28
Come on,https://redd.it/x6rbqn,HungryReplacement927,3587,256,2022-09-05
A rape victim whose DNA from her sexual assault case was used by San Francisco police to arrest her in an unrelated property crime on Monday filed a lawsuit against the city.,https://redd.it/xdxsor,tyw7,1813,299,2022-09-14
Naked British man arrested after going for a swim in Tokyo's Imperial Palace moat and throwing stones at police,https://redd.it/xeg4xr,Ok_University8781,3812,486,2022-09-14
Police don't understand the law?,https://redd.it/xeup3e,StevenKnowsNothing,770,32,2022-09-15
Man tries to rush towards Queen Elizabeth's coffin gets tackled by police,https://redd.it/xg95ry,The_Rebel_Nightmare,1410,199,2022-09-17
"A police officer in Colorado parked his cruiser on a set of train tracks with a woman inside. A train hit the car and she suffered 9 broken ribs, a fractured sternum, broken arm, and numerous injuries to her head, back, and legs.",https://redd.it/xn8w1e,Dennis_Gachanja,73692,5303,2022-09-25
A Sikh student at the University of North Carolina was forcefully detained by police for wearing his Kirpan (article of faith).,https://redd.it/xo7kx9,L_Lawliet678,33290,5816,2022-09-26
police ☕️,https://redd.it/xqndjp,VibhuPibhu,1282,268,2022-09-28
Russian girl who harassed Ukrainians and then urged to wipe butts with police summons is being deported from Germany to Russia.,https://redd.it/xtmjod,esberat,57338,1597,2022-10-02
Florida Police basically using an inaccurate algorithm to arrest kids and their families.,https://redd.it/xvk886,MisterFyre,947,109,2022-10-04
Police shoot a teenager who was just eating a burger in his car,https://redd.it/xyb05v,ClearWayLaw,8397,2022,2022-10-07
pro Putin supporter in US was not happy about Ukrainian demonstrations so she decided to spit on police. That didn’t end well.,https://redd.it/y1gflp,MavDrake,47412,3333,2022-10-11
When the grammar police have a point,https://redd.it/y1bt61,goodprocessing,2178,116,2022-10-11
Watch how police save the hostages?!,https://redd.it/y64yp0,Justice4ppl,456,44,2022-10-17
"Over 30K Americans have died from police violence from 1980 to 2018. WHAT CAUSES POLICE BRUTALITY? High rates of police killings are often a result of inadequate laws, racial discrimination, insecurity, and entrenched impunity.",https://redd.it/y6ze7c,Real_World123,335,151,2022-10-18
The difference between German police and American police was seen in two post right next to each other.,https://redd.it/y8ey0a,Dr_Downvote_,446,82,2022-10-19
Australian guy thinks he’s in America during a police stop,https://redd.it/yb8ix6,Chopsuiiisauce,3554,213,2022-10-23
Dutch police have arrested eco activists in The Hague after a protester attempted to glue his head to Vermeer's Girl with a Pearl Earring,https://redd.it/yeyp14,m3antar,9490,3737,2022-10-27
Policing in America: A legally blind man was walking back from jury duty when Columbia County Florida Sheriffs wrongfully mistook his walking stick for a weapon. When he insisted he would file a complaint the officers decided to arrest him in retaliation.,https://redd.it/ynzkig,knownothingwiseguy,136817,15310,2022-11-06
Running away from the police when you haven’t committed a crime,https://redd.it/yql964,kaioone,1576,289,2022-11-09
Being so full of hate that you call the cops on a child,https://redd.it/yuc6sj,RaiderOfZeHater,13284,970,2022-11-13
Qatari police confiscated brazilian flag from Pernambuco state thinking it was from lgbt support,https://redd.it/z1yghu,tommyjado,55618,2318,2022-11-22
When fleeing from Chicago police (and speeding) goes very wrong.,https://redd.it/z2ce9d,DuPageILLinois,332,57,2022-11-23
Danish journalist held back by Qatari Police. After USA vs Iran game at the World Cup,https://redd.it/z8ihyd,LynetPassiv,2039,164,2022-11-30
Rules for thee but not for me - Tampa Police Chief gets out of ticket by pulling her badge.,https://redd.it/zaxn1m,Axs_7x,7190,768,2022-12-02
IRAN - Police armored vehicle trying to run over a protester,https://redd.it/zfpyqe,Shahin_kyky,1497,100,2022-12-08
"Drug detection dog barking at Serbia's ex-Minister of Defense, ex-Minister of Internal Affairs/Police and current director of the Security Intelligence Agency (the one with short hair)",https://redd.it/zpcldk,staima_nemanista,1753,79,2022-12-19
police officer knows his priorities.,https://redd.it/zvflip,Taioo0,18167,1018,2022-12-26
Police officer knows his priorities.,https://redd.it/zw26fg,favorableapostle05,675,91,2022-12-27
Romanian police (DIICOT) released inside footage of Tate's arrest,https://redd.it/zynbuv,MrCookieDoughForever,1982,321,2022-12-30
[VIDEO] Cops help cover up police chief's DUI while complaining that dash / body cams have made cover ups more difficult,https://redd.it/100zgsy,wouldyoulikethetruth,28332,1459,2023-01-02
"""You need a license to ride a bike. Also, i'm arresting you because you're black."" - 5 Police Officers",https://redd.it/109g1qj,MisterFyre,2615,399,2023-01-11
Ted Cruz consoling a police officer who didn't intervene in the Uvalde school shooting.,https://redd.it/10amqrt,Tara_is_a_Potato,366,128,2023-01-13
german riot police defeated and humiliated by some kind of mud wizard,https://redd.it/10cfs82,dannybluey,189179,6715,2023-01-15
Police sex scandal,https://redd.it/10d9faj,Shadow474747,1753,322,2023-01-16
"Instead of actually solving crime, british police crack down on poor people pirating football streams.",https://redd.it/10dm6yz,baldi_863,486,89,2023-01-16
"Off duty police officer pulls gun on gas station patron he suspects of shoplifting, turns out he was dead wrong.",https://redd.it/10f59zh,troubled_broccoli31,28096,3244,2023-01-18
Woman tells police officer she will have sex with him to get out of DUI,https://redd.it/10hy93e,Akaki111,14501,1263,2023-01-21
Thief caught stealing a bicycle... From a police station,https://redd.it/10mvzas,zenn8080,180,35,2023-01-27
"In honor of Black History Month, Miami mayor Francis Suarez unveils black history police cruiser.",https://redd.it/10s1s0y,puzzledplatypus,929,306,2023-02-02
"Man steals car, drives it through mall, and robs electronics store. Police say the crime was ridiculous and brazen.",https://redd.it/10rfh08,diamondsodacoma,1808,159,2023-02-02
Police froze mentally ill inmate to death in a freezer,https://redd.it/112wysv,Visqo,824,102,2023-02-15
to go to work without being profiled and assaulted by police,https://redd.it/114jtmn,Olarenikeji,3424,1184,2023-02-17
Getting suplexed by police,https://redd.it/114n28p,QuicklyThisWay,743,186,2023-02-17
Chinese police have invented a new method to handle protests. Here’s the drill.,https://redd.it/114pwuv,iFoegot,1743,306,2023-02-17
Mother goes full karen and threats to stuff police officer into her pu**y after her daughter got pulled over,https://redd.it/1169lr5,1954isthebest,684,149,2023-02-19
2 police officers pull their guns on the guy recording. He did not have a weapon.,https://redd.it/1194s8e,Shinji415,3069,398,2023-02-22
Sheriff gives award to police officer who shot unarmed man in car for taking anxiety medication,https://redd.it/11bryka,zoebennetthanes,479,100,2023-02-25
Tried to show Mr.Police who's the boss,https://redd.it/11c8c1y,GeForce_GTX_1050Ti,295,55,2023-02-26
Police traffic stop went correctly. very rare.,https://redd.it/11enfh0,DiminutiveQuantity34,1515,244,2023-02-28
Police in London try to search his car because according to them he is in an area with disproportionality high level of drug crimes,https://redd.it/11fgptl,Shinji415,462,153,2023-03-01
Iowa police officer wants YOU to walk with blue,https://redd.it/11fh3qi,RunsWthGriszzlys,1338,70,2023-03-01
Rape is rape,https://redd.it/11hco0v,No_Biscotti_7110,5481,324,2023-03-03
11-year-old takes police on high speed chase in stolen school bus,https://redd.it/11hpjw1,RevolutionaryMedia1,2814,151,2023-03-04
Fleeing Florida motorcyclist flips off police before getting hit by truck,https://redd.it/11jg96z,Reg_Cliff,473,86,2023-03-05
"""Police Officer"" tells Uber Driver He Can't Record the Ride, and Gets Kicked Out",https://redd.it/11kuysi,sidewalkcurb,2734,333,2023-03-07
Police training in Cambodia,https://redd.it/11msfty,hiruma255,308,45,2023-03-09
DC Chief of police says average homicide suspect has been arrested 11 times prior to them committing a homicide,https://redd.it/11mtely,PineBarrens89,2403,391,2023-03-09
Police brutality at its best. You’re already about to handcuff the guy. He was not resisting arrest. But you beat his ass because he called you a tool???!!?? 😡🤬🤬,https://redd.it/11o3w7i,AndrewsTaint,4128,713,2023-03-10
Equality,https://redd.it/11oieho,xr_Killua,5411,754,2023-03-11
"Everything is good, the police is here",https://redd.it/11odd84,LiteratureOk5964,652,44,2023-03-11
What a meth’d up situation. “CALL THE POLICE”.,https://redd.it/11pc5xw,AndrewsTaint,791,71,2023-03-12
They probably have better things to do,https://redd.it/11pcy9o,uptightnourisher40,11643,399,2023-03-12
Police from Chicago bogus asl 😂 but dude was tripping while getting swarmed,https://redd.it/11qep8n,PumaNem,386,100,2023-03-13
"Rapper-singer Afroman, had his home wrongfully, failed raid by Ohio police, so he wrote a satirical song about it and used the security footage for the video. He is now, ironically, being sued by Ohio police for 'invasion of privacy'.",https://redd.it/11zz8zb,Ocelot859,36346,959,2023-03-23
Man arrested for punching girlfriend in the face smashes & throws computer at his own lawyer at the police station,https://redd.it/121k6xv,uchman365,4265,361,2023-03-25
Racist Police Officers are mad they got called out by a rapper.,https://redd.it/1245g5o,MisterFyre,4037,192,2023-03-27
"Afroman gets raided, now being sued by Adams County Sheriff Dept.",https://redd.it/124ryvl,dtn4427,6920,338,2023-03-28
Our local Police department chose the wrong color...,https://redd.it/1262n5f,SanguineSoul013,254,30,2023-03-29
6 year old gets arrested by police while crying for help,https://redd.it/1288lcl,Shinji415,36152,9560,2023-04-01
British police at its finest 👮‍♂️😅😂😅😂,https://redd.it/128zfoq,JAMZEYBOY,415,58,2023-04-01
Men harassing female police officer in Venezuela,https://redd.it/129rary,Plus-Relationship833,72065,1886,2023-04-02
New Mexico police shot and killed a man after they went to the wrong house while responding to a domestic violence call,https://redd.it/12eku83,dontfollowthesheeple,6547,608,2023-04-07
Police officer decided that he doesn't have to do his job.,https://redd.it/12fsp08,MisterFyre,571,74,2023-04-08
Police ticketing people for giving food to the homeless in Houston.,https://redd.it/12gayce,Nefarious_Archfiend,2465,387,2023-04-09
The Grammar Police actually kicked in,https://redd.it/12hpc36,ColossalMcDaddy,1532,53,2023-04-10
Police raided a Chicago video shoot and recovered 17 firearms many equipped with illegal switches🤦🏿‍♂️🤦🏿‍♂️🤦🏿‍♂️,https://redd.it/12t7vup,_s_y_m_,40858,1800,2023-04-20
"School Board member calls police chief a ""skinhead"" over a speeding ticket",https://redd.it/12vmz18,PineBarrens89,15811,1414,2023-04-22
Police arrest young girl when parents aren’t home,https://redd.it/12xg288,No_Contribution2112,48297,3456,2023-04-24
Police officers allegedly held hostage and beaten up by mob in Kaliganj (India),https://redd.it/1305jm6,Anna---Prince,143,76,2023-04-27
Man wastes police officer's time,https://redd.it/13353ul,N1c0s1,2815,172,2023-04-29
Police officer chases pig for no reason ,https://redd.it/139ybmr,RedditIsAHouseOfLies,244,42,2023-05-06
Police department apologized for...,https://redd.it/13auil0,Kuthibale,47,28,2023-05-07
Police arrest man for filming a police crash,https://redd.it/13bygc6,LovableJackassv4,83953,5193,2023-05-08
Period of police training in western countries,https://redd.it/13bmg52,HotDressa,12178,1142,2023-05-08
"Woman rams police vehicle with child in the car, hitting bystander and acts oblivious when finally taken out of her vehicle",https://redd.it/13bypxf,WedCornet,20427,2085,2023-05-08
man tries to bait police officer,https://redd.it/13b8l1z,LovableJackassv4,1562,287,2023-05-08
"""Doing"" their job",https://redd.it/13dpaq8,pietradolce,11491,729,2023-05-10
"Police Get Surrounded and Flee From Cartel Members, Leaving Partner in Mexico",https://redd.it/13i8t6y,narcomappingmx,794,79,2023-05-15
Guy acts as a none target in a live firing range police training.,https://redd.it/13hy10m,randomredditguy94,67261,3694,2023-05-15
NSW police making excuses for tasering a 95 year old lady,https://redd.it/13m79po,rgatoNacho,776,244,2023-05-19
Police Bicycle Training Fail (Old Footage),https://redd.it/13o3qsu,Mines_a_mojito,304,8,2023-05-21
Woman harasses police officer in Indianapolis Indiana.,https://redd.it/13q45jt,Lazy_Mouse3803,23160,4758,2023-05-23
NSW police try to justify tasing a 95 year old woman in a walking frame... ,https://redd.it/13rebb0,triniazhole,563,132,2023-05-25
So much for the police cracking down on this issue amongst their fellow officers,https://redd.it/13sy98d,Comfortable-Grabber,152,63,2023-05-27
Police Officers or Child Kidnappers? Hard to tell these days.,https://redd.it/13u7yb8,MisterFyre,26900,2433,2023-05-28
"When police ask you next time ""What were you thinking when you did this?""",https://redd.it/13uydmj,RaiderOfZeHater,1626,103,2023-05-29
Policing the New York City subway system,https://redd.it/13wtlej,Tribiani94,3801,1133,2023-05-31
Man Robs Taxi Driver In Front Of Police (pistol involved),https://redd.it/13xm0rd,Downtown_Lock7452,415,28,2023-06-01
Suspect steals police car and runs off,https://redd.it/13xpwc1,Downtown_Lock7452,317,111,2023-06-01
Detained Woman Gets Ahold Of AR-15 In The Police Car And Fires Shots,https://redd.it/13xs1dm,Downtown_Lock7452,12019,1490,2023-06-01
British police seem highly effective at their job.,https://redd.it/13xqzk7,strokeright,151,137,2023-06-01
Shoplifter tries to shoplift from Champs and gets confronted by employee. He then gets his stuff back and calls the police on her.,https://redd.it/13xbwwq,Lazy_Mouse3803,11888,1175,2023-06-01
man uses child as human shield against police (baby wasn’t injured),https://redd.it/13ynoy3,Downtown_Lock7452,7779,1662,2023-06-02
Just got released from jail and blames on police 🤦🏾‍♂️,https://redd.it/141ge1v,Denzel09,10176,1794,2023-06-05
Police assaulting innocent pride participants at a no-police booth.,https://redd.it/14115xw,MisterFyre,243,321,2023-06-05
