Title,URL,Author,Upvotes,Comments,Created UTC
Police officer stops traffic to help a kitten stuck in the road,https://redd.it/47122c,SlimJones123,1446,35,2016-02-22
Firefight with police in a residential neighborhood!,https://redd.it/4uutgb,NoWhiteLight,2742,141,2016-07-27
Two police officers bought lunch for a mentally handicapped man at Taco Bell (Louisiana),https://redd.it/59j8bz,mowww,2592,46,2016-10-26
This boy asked his mom if he could go hug the police officer,https://redd.it/626cn2,Grown_Man_Poops,17068,330,2017-03-29
One of many police cars in Stockholm today after the horrific terrorist attack that happened on friday.,https://redd.it/64dn6e,DianaEU,1303,21,2017-04-09
Police dog recruit,https://redd.it/6ht6g5,ShaneH7646,279,4,2017-06-17
Police doggos at the train station not wanting to police,https://redd.it/6pvkc3,GallowBoob,28396,427,2017-07-27
This little boy asked his mom if he could go hug the police officer,https://redd.it/6u3lwb,gonne,1629,36,2017-08-16
Police officer helps a skunk out.,https://redd.it/73ro7f,deathakissaway,317,10,2017-10-02
Police man loves pranks,https://redd.it/74e2ya,white_privlage,24919,206,2017-10-05
Police Making Sure People Are Driving Safely...,https://redd.it/7c7pj4,maltaa,27354,1434,2017-11-11
Kind Police Officers.,https://redd.it/7n1vp1,air28uk,158,11,2017-12-30
Police officer receives award from man he helped save. I felt like this belonged here.,https://redd.it/80h1jv,ReaperOne,23313,428,2018-02-26
Police officer saves the dog who fell in river,https://redd.it/88igvc,Faddelul,1111,21,2018-03-31
Poster outside a police station in India.,https://redd.it/89cp7g,chotu_ustaad,466,23,2018-04-03
This little boy asked his mom if he could go hug the police officer,https://redd.it/8hm8gq,godpunk,2014,54,2018-05-07
Saudi Police offering roses and chocolates to woman drivers,https://redd.it/8tn63r,wincispider,737,18,2018-06-25
This guy doing a magic trick in front of two police officers,https://redd.it/8yuysr,Glumbot_2,2236,78,2018-07-14
The city police in my area are pulling kids on bikes with helmets over! My daughter won’t stop talking about it!,https://redd.it/93999z,AmericanDoggoThief,58722,1242,2018-07-30
little boy secretly rang 999 to invite the police to his birthday party.,https://redd.it/97vnpu,Ordinary_Kurkure,31087,805,2018-08-16
"Police in the Netherlands giving out ""trauma teddies"" to kids involved in car accidents (x-post r/aww)",https://redd.it/9cg197,EagleStrike0,712,30,2018-09-02
Kansas City fire department rescues Kansas City police department from a stuck elevator,https://redd.it/9micjo,etymologynerd,2614,30,2018-10-08
Police Officer Proposing,https://redd.it/9o9mhh,LocalJim,409,12,2018-10-15
95 year old man helped out by police,https://redd.it/9r1sp1,xX1THICCBOIXx,501,8,2018-10-24
German police officer clearly has fun while doing his job,https://redd.it/9sxcmt,tarek122,1187,35,2018-10-31
Man meets police officer who saved his life,https://redd.it/9u9hw3,downvoteforwhy,532,16,2018-11-05
Some people called in complaining about kids sledding on a hill. Police arrived and made sure it was safe for them.,https://redd.it/afr3xh,GuyWithGun,1219,29,2019-01-14
Police officer saves a frightened puppy,https://redd.it/akb9j3,IncandescentlyHappy,37482,447,2019-01-27
Chilean police rescue trapped dog,https://redd.it/axa2zh,ONLYVIP,317,11,2019-03-04
Chicago police officer rescues dog from Lake,https://redd.it/b3b3zd,NazmulHossainRana,661,13,2019-03-20
Wholesome police department made me smile.,https://redd.it/bk1kal,Ekaceseehc,490,12,2019-05-02
Police making sure people drive safely,https://redd.it/c357u4,HellsJuggernaut,205,16,2019-06-21
This is how you police,https://redd.it/cl86e6,Pythagoras_,1026,35,2019-08-02
German police and protestor,https://redd.it/cn48wn,flopygooftop,165,5,2019-08-07
Wholesome Police officer’s mom,https://redd.it/dxdn7g,Stoon5555,467,4,2019-11-16
A police officer’s post on Facebook about my friend group,https://redd.it/eb63l4,PrimeAres,24319,492,2019-12-15
5 year old calls police to invite them to his birthday party and they actually turn up!,https://redd.it/eu8meh,SomejuanHelpMe,2795,77,2020-01-26
"In the middle of the coronavirus outbreak, a civilian brings his local police officers a case of mask that is becoming increasingly hard to get. Keeping his distance, as they are told to do, the officers can only salute him.",https://redd.it/ev51m2,cinephile46,3038,81,2020-01-28
Woman rushes into a police station with a lifeless pup,https://redd.it/exktc8,jasontaken,366,17,2020-02-02
Grand Rapids Police Department in Michigan.,https://redd.it/f0cmhu,D0NW0N,1469,26,2020-02-07
"This is my awesome kid. He is 6 and has a genetic variation that causes severe apraxia & autism. He loves police cars (wee-oo-wee-oos) more than anything. He is in California with his dad visiting family, and I got this picture sent to me today (His uncle is a police officer). Made my heart sing.",https://redd.it/f1n5c7,booghawkins,5834,58,2020-02-10
"This is Chico! He managed to get lost so he went to the police to report himself missing, he was safely returned to the owners and is safe at home",https://redd.it/f8qeil,Spacceee,55239,315,2020-02-24
Police academy recruits must try not to laugh to pass the chicken test.,https://redd.it/f9rybq,reva_r,410,32,2020-02-26
Police engage in a shootout with a local youth gang.,https://redd.it/fh6kxz,PR0CR45T184T0R,4449,85,2020-03-11
Police engage in a brutal shootout with a group of kids,https://redd.it/fhzxsg,henlo_my_guys,275,8,2020-03-13
Good Police!,https://redd.it/fwo7gj,JangoSquirrel,148,1,2020-04-07
Newest police recruit,https://redd.it/g7g0xo,oplionam,4753,72,2020-04-24
White people forming a human barrier between black protestors and police. Actions > words,https://redd.it/gt68nk,nekkototoro,3928,136,2020-05-30
Police officer being escorted to safety,https://redd.it/gu70n0,SaltySlade,188,5,2020-05-31
My local police force (Jackson Tn) brought water and supplies to the BLM protest today downtown.,https://redd.it/gtp7ru,therealtomgreen,283,22,2020-05-31
Dutch police officer doing Dutch things,https://redd.it/gu3oet,Thund3rbolt,316,28,2020-05-31
"Spokane Police took a knee to stand with the protestors against police brutality, the crowd began to cheer. Prior, the protestors were throwing stuff at them. Instead of violence, there was peace and hope for change across our nation. Change that needs to happen. Photo from @youngkwak.",https://redd.it/guax14,xxTigerShark,978,37,2020-06-01
Police chief of Santa Cruz county police department participates in peaceful protest!,https://redd.it/guupo1,trapgod41510,53,2,2020-06-01
I live in a small town in Southern Virginia. Our Chief of Police stands with the protesters.,https://redd.it/guvvmu,bcam9,361,19,2020-06-01
"The people of Derry, Northern Ireland in silent protest for George Floyd and the countless others killed through police brutality. We hear you, we stand with you.",https://redd.it/gvay8g,dwarvengoth,7330,42,2020-06-02
Nickelodeon went off the air for a full 8 minutes and 46 seconds to protest police brutality,https://redd.it/guz77q,Lord_Alpha01,1667,43,2020-06-02
"An 87 years old woman called the police emergency number in Florence, Italy, saying she was alone and hungry. This was the result.",https://redd.it/gw2thp,Doxep,7083,146,2020-06-03
"The police taking a knee in near unison after the protestors. That hug in the end nearly made me cry. This is what we are missing, this is what we need.",https://redd.it/gwv7is,thiqqnquicc,1556,93,2020-06-05
My hometown police chief,https://redd.it/gwtomw,kane3232,8003,124,2020-06-05
This little boy asked his mom if he could go hug the police officer,https://redd.it/gxjdc1,DavisAF,1892,19,2020-06-06
Police engage in a shootout with a local youth gang,https://redd.it/h0zxtj,jasontaken,933,48,2020-06-11
Dutch police giving teddy bears to children after a car crash to help with the trauma,https://redd.it/hf8joo,lol62056,5435,132,2020-06-24
"As Aurora Police in riot gear sweep the protest from the municipal park during the Elijah McClain violin vigil, this dude fires up his electric violin and literally stopped the police a few feet away",https://redd.it/hhwnn6,BearsNecessity,781,22,2020-06-29
These are the type of police that help people,https://redd.it/hlpxb7,lol62056,3444,69,2020-07-05
Norwegian police,https://redd.it/hobsu0,spdwarf,2926,65,2020-07-09
We need more police like this,https://redd.it/hpcz6o,markfearon07,860,49,2020-07-11
Dutch Police,https://redd.it/hpdf3u,Tommyv2,5554,43,2020-07-11
Police officer rescuing a very grateful pup,https://redd.it/hp4sex,envysteve,182,11,2020-07-11
7-year-old boy who got his bike stolen is gifted a new one by the local police,https://redd.it/hxwnvz,TooShiftyForYou,342,22,2020-07-25
This seven year old boy was brought to tears after he received the best birthday surprise from his his local police department.,https://redd.it/i0db51,mmajunkie77,1284,57,2020-07-30
The friendliest police officer,https://redd.it/i626mh,SonGohan666,2614,46,2020-08-08
"Dance battle, Boy vs Police officer",https://redd.it/ieit6k,zaynthelegend,601,33,2020-08-22
Police officer doing his best to keep mama duck and babies safe,https://redd.it/iqlimg,Kevin_0019,581,11,2020-09-11
Police patrols during lock-down in a deserted street after snow,https://redd.it/jxp5hf,bilegt0314,1597,24,2020-11-20
A dog being saved by a police officer,https://redd.it/jxk0rs,TraditionSeparate,471,41,2020-11-20
school police officer plays the drums,https://redd.it/k5zlry,spookytimz,117,11,2020-12-03
Police Siren,https://redd.it/k7sy80,pkkballer22,84,10,2020-12-06
Good police officers,https://redd.it/k9cmom,Newguyinliverpool,131,1,2020-12-08
"Police Officer Playing With Children, In New York, 1970.",https://redd.it/kc7dap,Sleeeepy_Hollow,198,9,2020-12-13
The right way for police,https://redd.it/kd38vo,904569034193454,246,3,2020-12-14
"imagine this police, everybody willing to pull over",https://redd.it/klkwnf,Lalakhalid,203,11,2020-12-28
A police officer rescuing a dog after it accidentally fell into a lake.,https://redd.it/kmy4wz,manish__tomar,518,23,2020-12-30
New Zealand police just having the best darn time at Rhythm and Vines,https://redd.it/kov4lk,Caliixox,360,10,2021-01-02
New Zealand police supervising a music festival,https://redd.it/kp0v60,squarepusher6,218,8,2021-01-02
Wholesome police helping kids settling a debate,https://redd.it/kqmkog,sangriya,666,12,2021-01-05
Romanian Police Special Operations,https://redd.it/kvt3up,Thesnakeissafe,101,2,2021-01-12
Police officers assault kids that are fighting with snowballs,https://redd.it/kw9gzk,eubest11,3059,242,2021-01-13
"Eugene Goodman, the Capitol Police officer who led rioters away from the Senate chamber, will escort Kamala Harris at the inauguration",https://redd.it/l1bmyl,RaboKarabekiann,3452,39,2021-01-20
Dog Strolls Into Police Station To Report Himself Missing.,https://redd.it/l36c3h,MeliaDanae,794,11,2021-01-23
"Last Friday I lost my wallet in a city famous for pickpockets and today the police called me and said it had been handed in with all the contents still inside. Thank you kind stranger, wherever you are!",https://redd.it/l78bgk,lucystrongarms,2134,38,2021-01-28
Police Gave me hope,https://redd.it/lk9itp,jjs0793,35,15,2021-02-15
Police dogs birthday ☺️,https://redd.it/louoid,HisokaLaMagician,413,29,2021-02-21
Pakistan launches totally radical police unit,https://redd.it/lqx4og,tardigrade_h2k,78,26,2021-02-23
"Police officer unaware of the imminent danger, Chicago, 1959.",https://redd.it/lslrky,Sleeeepy_Hollow,343,7,2021-02-26
Army soldier surprises little brother in school with the help of a police officer,https://redd.it/m3kbqv,d8dotrs11,178,29,2021-03-12
"Inspector R Sanjay Kumar of Nampally Police Station, Hyderabad, India.. His force saved a four-month-old child 15 hours after he was kidnapped",https://redd.it/m4qgsu,unambiguous_jay,1063,17,2021-03-14
When you have a POLICE DOG as your PET!,https://redd.it/mhsfxy,djanuj90,380,7,2021-04-01
"Our autistic son’s window overlooks a park. When he yells to get kids attention, people were calling the police thinking someone was in distress. We made a 7 foot banner of him as his fav musician to let people know he’s safe and happy. Now he gets friendly waves every day from kids in the park.",https://redd.it/miz3oh,Timfrostyo,58971,611,2021-04-03
This police officer does an adorable proposal to his partner,https://redd.it/mlfp5v,lol62056,3833,373,2021-04-06
Light-hearted snowball fight with police in Amsterdam.,https://redd.it/mmzzf1,PenguinAreCake,141,7,2021-04-08
Good police work.,https://redd.it/mpzcx8,heybrother11,79,8,2021-04-13
An artist beautified the spot where 13 yo child Adam Toledo was shot by Chicago police.,https://redd.it/msj7kg,targaryenofvalyria,311,54,2021-04-17
Thai police dealing with a knife attacker,https://redd.it/mxbab6,Thryloz,983,29,2021-04-24
Got my Passport verification done at the police station. COP doesn't seem too happy as he didn't find any Weed as expected. Keep Smiling:)),https://redd.it/n36ma1,Dreadindian,3723,116,2021-05-02
"Redmond, WA police rescuing baby ducks from a storm drain",https://redd.it/nk7g76,VVynn,78,16,2021-05-24
Baby deer crying while stuck in fence saved by on-duty police officer,https://redd.it/o22uip,Allstarhit,647,16,2021-06-17
a north carolina police officer takes the time to sit with a young autistic boy who was mentally struggling and helps to console him,https://redd.it/o3ncyt,bewarethechameleon,690,33,2021-06-19
Greenport police give a special visit to a 6-year-old as his birthday gift!,https://redd.it/ob1b64,UnknownAlien123,10937,474,2021-06-30
Dutch police evacuating elderly couple during flood,https://redd.it/olelj5,Veradio,13209,166,2021-07-16
Dutch police doing a kickflip ❤,https://redd.it/otbxce,DutchSpaceMan,179,6,2021-07-28
"Police Academy Recruits Must Try Not to Laugh to Pass the ""Chicken Test""",https://redd.it/p14b7m,Chasith,1659,153,2021-08-09
Wholesome Dutch police.,https://redd.it/p5k16m,colreaper,405,10,2021-08-16
A traffic police help two dogs to cross the busy road. Good Hooman.,https://redd.it/pf2z33,surajvj,666,25,2021-08-31
Police officers can be fun too y'know!,https://redd.it/pgfz6q,Redditoridunn0,578,69,2021-09-02
"Police man, rescues a puppy that became entangled in a network while he was alone in a home.",https://redd.it/pl6wk6,Mohan_Yadav,16977,386,2021-09-09
Police watching over a sloth crossing the street,https://redd.it/pmhfch,blue-birdz,3961,126,2021-09-11
"police pulling over the car for speeding, rush the unconscious kid to hospital instead.",https://redd.it/pmqig1,TryhArd25,4872,143,2021-09-12
"This woman stole 5 eggs to feed her kids . Instead of arresting her , the Police officer bought her a Truckload of groceries . This is what we call Humanity.",https://redd.it/pwzkcy,Cyber_Being_,3890,105,2021-09-28
This police officer saving a dog who fell into a river,https://redd.it/q8hvwe,Zx2_,378,5,2021-10-15
New Zealand Police receive a call from a 4 year old wanting to show them his toys,https://redd.it/qailxz,bfly1800,92056,1760,2021-10-18
"My wife doesn't want me snacking late at night, but here are these two goons CAUGHT RED HANDED eating MY noodles behind my back. Took this picture as evidence right before I called the police. I hope they have chopsticks in JAIL.",https://redd.it/qcot8y,Rpark888,142209,1637,2021-10-21
"No one came to this 8-year-old's birthday party, so Hurst police got involved",https://redd.it/qe53ag,legendary_Russian,151,44,2021-10-23
Police officer joins in for a quick dance off.,https://redd.it/qfc4v1,criteriaz,1905,43,2021-10-25
Italian police delivering donated kidneys,https://redd.it/qjsive,Story-tellin-yungstr,21,11,2021-10-31
Police officer rushing to the aid of a drowning doggo.,https://redd.it/qocomk,5_Frog_Margin,1106,24,2021-11-07
The positive impact of community policing,https://redd.it/r6mum7,thenewyorkgod,228,5,2021-12-01
This police constable who took doughnuts to the university near by to surprise students studying for finals.,https://redd.it/rajih3,Waifer2016,131,25,2021-12-06
Innocent police,https://redd.it/rakt5u,LAKAMAKAF0,1786,74,2021-12-06
An innocent Police.,https://redd.it/rao17l,brief_kingdom,73,12,2021-12-07
Weird Al,https://redd.it/rtx8ry,Affectionate-Pop8781,99493,1661,2022-01-02
Police Officer Dances to Siren Beat,https://redd.it/s2qxzq,Vascular_D,140,39,2022-01-13
Police officer saves an infants life :) (credit to daily dose of internet),https://redd.it/sa8ov5,reddityschmeddityboi,307,9,2022-01-22
New Zealand Police fill elevator silence with sick beats,https://redd.it/sbi35k,CooLDuDE-6_9,1406,21,2022-01-24
Epic Snowball Fight Between Police and Public In Istanbul/Turkey,https://redd.it/sc1q8e,Engcnysf,684,22,2022-01-25
"When the Fire Dept. and Police are next door neighbours , hijinkery is guaranteed",https://redd.it/scnzjx,Waifer2016,251,10,2022-01-25
How this police officer handled a noise complaint.,https://redd.it/set8g6,southwoodhunter,104,7,2022-01-28
Police Officer does something nice and takes it a step farther,https://redd.it/sj234e,ohsinboi,13878,363,2022-02-02
Police officer stops in the middle of a snowstorm to snowball fight with students,https://redd.it/sj0uqy,williamshakepear,338,14,2022-02-02
Police officer helps out a working mom and gifts her birthday cake for her 1yo,https://redd.it/sjql6z,DragonChasm,160,13,2022-02-03
New Zealand Police have shared an emergency call they received from a 4-year-old boy wanting to show them his toys. Southern District Police responded by arriving at the child’s house and was shown an array of toys. Video: New Zealand Police,https://redd.it/sniybu,diobrando60,58,2,2022-02-08
Then the police give you a helping hand.,https://redd.it/src5lz,bananalordkunsama,120,6,2022-02-13
St. Louis police is different,https://redd.it/ssi17n,Starry-Striped-Sky,153,9,2022-02-14
"Mason County, WA Police Officer comforts baby after a car accident.",https://redd.it/sz2851,Bancer705,114,15,2022-02-22
Vegas Police Officer Adopts Five Children,https://redd.it/szg6o5,InertWRX,42,6,2022-02-23
Police can't believe their eyes as they chase 'runaway dinosaur' down the street.,https://redd.it/t0ho00,Cyber_Being_,2563,27,2022-02-24
Dutch police officers were checking on an Ukrainian truck driver. Man started crying because his family was in Kharkiv and his bank account was blocked. Police offered him two lunch packages and started a fundraising campaign for Ukrainian truck drivers.,https://redd.it/t1nnyq,red_dog_is_dead_dog,1768,11,2022-02-26
"Polish police officer soothing a baby, helping a mother, after she just crossed the border from Ukraine on foot.",https://redd.it/t3g3wa,keicam_lerut,8645,191,2022-02-28
"Daughter wrote note to the police, they respond on Facebook (OC)",https://redd.it/tn8fl6,ellmarieB,34,22,2022-03-24
kids got interrupted by the police,https://redd.it/tpievx,slampard803,3370,76,2022-03-27
Traffic police personnel offering water to a monkey in hot summer.,https://redd.it/tvyjpg,IllustriousPresent7,255,7,2022-04-04
"Rapper 6ix9ine gives away $50,000 to a random Mexican family that are Poor",https://redd.it/ubxoof,Perfect_Gas,22328,3256,2022-04-25
Police Repellant,https://redd.it/ufijtw,Pschobbert,437,7,2022-04-30
Belgium police be like,https://redd.it/uqe2s7,VECMaico,60,3,2022-05-15
Wholesome police officer,https://redd.it/us5rni,greatauror28,19570,491,2022-05-18
"Police dog, after more than 8 years of service, gets a call that he can retire",https://redd.it/uu8rgv,shaderr0,2100,126,2022-05-20
Mumbai Police: Such a sweet Request.. [OC],https://redd.it/uznsbr,gratefulmalive,12,2,2022-05-28
The sound and impact of the Police! (OC),https://redd.it/vhr7kd,KunAkn,24,7,2022-06-21
Police officer remembers man from previous encounter,https://redd.it/vu58ky,iThinkaLot1,863,20,2022-07-08
German police does a little dancing at the parade,https://redd.it/vw494c,WaferDisastrous,10453,233,2022-07-10
The Kansas City Fire Department had to rescue 12 Police officers stuck in an elevator,https://redd.it/vwpz4c,DePasta,1660,69,2022-07-11
Police officer giving water to a guard outside buckingham palace during hot weather,https://redd.it/w2534u,wolfchompmyanus,110,19,2022-07-18
Police officer vibing with participants of a pride parade,https://redd.it/w2tnl5,Dry-Introduction-800,179,14,2022-07-19
Retirement ceremony of a police dog,https://redd.it/w5hp2w,StrangerInAlps,15144,172,2022-07-22
Police Captain breaks down while calling to tell man that they had finally captured his mother’s killer after 35 years,https://redd.it/w9e4mo,nicky77477,487,27,2022-07-27
"a passenger shows a good gesture and throws his umbrella to the traffic police , who is working in rain",https://redd.it/wkugeg,charlesrichard1994,933,17,2022-08-10
Police training..,https://redd.it/wlooj9,kitten-cat08,95,7,2022-08-11
This police officer helps mute woman at the dmv when no one else could understand her,https://redd.it/wochgp,TXVERAS,2796,93,2022-08-14
The most intense police chase in Prague,https://redd.it/wrnpt8,carebearstarefear,41,5,2022-08-18
"Police officer playing with children in Harlem, NY, 1978.",https://redd.it/wwnxmm,GaGator43,226,9,2022-08-24
Moroccan police officer feeding a special needs supporter in a football game.,https://redd.it/x9zdc1,zakmolchi,164,2,2022-09-09
Iranian women burning their hijabs after a 22 year-old girl was killed by the “morality police”,https://redd.it/xjzm78,mossadnik,93800,188,2022-09-21
"From todays protests against compulsory hijab in Iran. This fearless women took her hijab off in front of the Islamic morality police, who killed dozens of other girls this week.",https://redd.it/xo8muo,Suspicious-Candle692,735,31,2022-09-26
Worlds most adorable police chase,https://redd.it/y6mgpk,TheTonz,341,23,2022-10-17
Dog duly reports herself missing to police stations,https://redd.it/yvv10n,schonrichtig,21,2,2022-11-15
Police brutality no more,https://redd.it/yyz418,Kozzinator,65,1,2022-11-19
Qatari Royal Police on horseback followed by Mexican fans using the same mode of transportation during the World Cup,https://redd.it/z3baz1,cometweeb,465,6,2022-11-24
A Police Dog getting retirement presents from the whole community,https://redd.it/z5d1u0,somelittleindiankid,212,9,2022-11-26
(OC) this was not in my neighbours backyard last night!?,https://redd.it/zcblmm,Averageguyjr,993,57,2022-12-04
Police deliver 31 recovered packages found in stolen car,https://redd.it/zoh9es,gcwardii,25,2,2022-12-17
A pleasant prank on the police officer,https://redd.it/zpb6gn,Tj-Tengu,96,3,2022-12-18
Not all police are on the naughty list. I'm a janitor that cleans the PD 3x weekly. this is my gift,https://redd.it/zttjfz,noonespxial,80530,1275,2022-12-23
(OC) My son is a police chief in a small Ohio town. This year he raised $1200.00 for a hometown toy drive and delivered presents to kids in his town. He even arrested the Grinch.,https://redd.it/zv0390,fishlesstuna,18223,561,2022-12-25
Andrew Tate arrested in police raid as part of human-trafficking investigation,https://redd.it/zyuqme,supral0ver,11,6,2022-12-30
Awwh,https://redd.it/zzmn2e,EllieNekoGirl,64857,569,2022-12-31
Little doggo signing up for the police force.,https://redd.it/100gzdd,trippy_o_o_Panda,72,8,2023-01-01
Dog rescued by police from dogfighters is treated like a prince.,https://redd.it/107dmd1,Own_Chipmunk_9635,57,8,2023-01-09
German police removes climate protester from lignite mine - she gives an interview,https://redd.it/10apcya,Hematophagian,771,54,2023-01-13
(OC) My Smile Factory 👀,https://redd.it/10cun13,seedsandkeys,11139,559,2023-01-15
"Meet future PC Harry! Harry has had a truly awful time recently, and when the police heard how much he loves his new Christmas present, an electric Police bike, the police paid him a visit! Harry professionally led them round his street in full uniform.",https://redd.it/10d3r3q,freddie54,61,4,2023-01-16
Police dog in Wyandotte accused of stealing fellow officer's lunch,https://redd.it/10fdzp0,WilliamMorris420,656,33,2023-01-18
Rhode Island Police Department Helping Jr Detective Find Identity of Santa,https://redd.it/10h1z7b,Hot_Introduction_270,11,2,2023-01-20
Yale honors the work of a 9-year-old girl whose neighbor reported her to police,https://redd.it/10syla8,craZbeautifuldisastr,9213,382,2023-02-03
She was reported to the police for spraying invasive lanternflies. Now she's been honored by Yale | CNN,https://redd.it/10ucmx7,rabb1thole,243,15,2023-02-05
Police officer remains calm and professional,https://redd.it/111oo2o,imthelittlefawn,1533,100,2023-02-14
"In 1959 Police were called to a segregated library b/c a young Black boy was trying to check out books and refused to leave unless he had them. Determined, he later received his Ph.D. in physics from MIT and became a U.S. astronaut. The library is now named after him; respectfully Mr. Ronald McNair!",https://redd.it/1133k5x,Beautiful_Facade,2591,38,2023-02-15
Student juggles to prove his sobriety to police,https://redd.it/118i3hh,throwawayllllllllll1,71,10,2023-02-21
This little boy asked his mom if he could go hug the police officer,https://redd.it/118csod,FarReaction7,14431,852,2023-02-21
Student juggles to prove his sobriety to police,https://redd.it/118hal6,snrpro,4642,163,2023-02-21
Police stops a motorcyclist and ask him if he could deliver the medicine that was accidentally dropped.,https://redd.it/119t1kq,Sxzym,626,13,2023-02-23
Irish marching police force friend to get in parade . Wholesome,https://redd.it/11uqbkk,hdogg2970,188,5,2023-03-18
German police at pride parade,https://redd.it/129jo6h,davidwallacecto,90114,2506,2023-04-02
Police Officer Reunited with 1 year-old boy he Saved from Drowning,https://redd.it/12v3tf1,kevtheproblem,1197,10,2023-04-22
Iraqi Police Ubering Food to Students,https://redd.it/12vkn6o,halal-honcho,951,40,2023-04-22
