Title,URL,Author,Upvotes,Comments,Created UTC
a 4 year old boy saves his mother's life by phoning the police after she passed out!,https://redd.it/130ng2v,bewarethechameleon,9702,197,2023-04-27
"Bodycam shows Oklahoma police searching for someone yelling for ""help"" - it was a goat",https://redd.it/13ea5sd,coffeeandtrout,28,3,2023-05-11
Family Of Ducks Get A Police Escort Across The Road,https://redd.it/13oyp1l,EcstaticSociety4040,2868,84,2023-05-22
"Sudbury, Ont., police respond to 'noise' complaint, end up joining basketball game",https://redd.it/13q56t6,DesperateRace4870,9,1,2023-05-23
Police in Pune (India) giving roses away to appreciate people on Helmet day ,https://redd.it/13rqafk,Vodka_Master,258,4,2023-05-25
this cat works at a police station and shows hardwork and dedication,https://redd.it/13yab84,usedchloroform,5265,71,2023-06-02
Police officers show up at Woman’s house after reports of something hanging from her car trunk 😂,https://redd.it/14nklyf,FoI2dFocus,170,2,2023-07-01
"In the absence of a wheelchair, a railway police officer personally lifted and carried a passenger, an elderly woman, into the train in Mumbai",https://redd.it/14r2tml,meghrathod,531,7,2023-07-05
Carlisle Police supporting an officer with Dyslexia,https://redd.it/1507tyf,Orri,1168,104,2023-07-15
Kevin Heffernan apologies to Winnipeg police officer that looks like Farva.,https://redd.it/15382ed,BrewedinCanada,10,3,2023-07-18
Some people's kids 😁,https://redd.it/15jqtj1,Ganjagirrrl25,7980,31,2023-08-06
Bushman vs Italian police ,https://redd.it/162zd3t,Dan_832,3759,35,2023-08-27
Norfolk police pull over man with bull riding shotgun,https://redd.it/166er8q,jonboalex,10,2,2023-08-31
A Police officer came to give the King's Guard some water in the scorching sun.,https://redd.it/168360z,Knight_TheRider,6869,213,2023-09-02
He surprised her with Taylor Swift tickets,https://redd.it/169bkev,ChrisMMatthews,4257,313,2023-09-03
"(OC) This is Yoda the Police Dog. He caught a murderer on the run in Pennsylvania. Yoda's a very brave, amd good boy.❤️❤️❤️❤️❤️",https://redd.it/16i3l8b,Tamarama---,2033,64,2023-09-14
W Police Officer,https://redd.it/16ir81v,Previous-Giraffe-962,643,14,2023-09-14
"The german police on the Oktoberfest making music, combining an own DJ stage with occasional safety announcements :D",https://redd.it/16l2ebt,Morgentau7,9494,469,2023-09-17
"In 2011,a police officer saved a 1-year-old boy from drowning.
12 years later, he reunited with the same boy for the first time.",https://redd.it/16mimpd,Homunculus_316,7985,64,2023-09-19
Police dog vs Undercover police dog,https://redd.it/16vu79d,EndersGame_Reviewer,77,1,2023-09-30
A police officer tries to save the life of a kitten (who fell from a building) with PCR,https://redd.it/17di5f3,Forthass,993,27,2023-10-22
"Police K9 diagnosed with cancer gets saluted by her entire team in her final walkout 🐕🚨
",https://redd.it/17fxqfy,Soloflow786,53083,1322,2023-10-25
New Zealand police guiding ducks off the busy motorway,https://redd.it/17isbnr,AjazeMemez,986,28,2023-10-29
A police woman breastfeeds a baby from a misplaced family during Acapulco rescue efforts.,https://redd.it/17jg471,pelosnecios,141,19,2023-10-29
Police officer promoted after act of kindness in Acapulco,https://redd.it/17w0cn9,Redraffar,31,3,2023-11-15
Police officer pulls over his own boss for speeding,https://redd.it/17yw0aq,Zenz-X,6740,289,2023-11-19
Man in China travels far to return US$28 borrowed from police when penniless,https://redd.it/18n1vsv,quil1,16,1,2023-12-20
"The Royal Flying Doctor, with an airborne police escort, landing a jet on an Outback highway. They land on dirt strips too. No cost to any patient; Australian or tourist. Fleet of 81 aircraft overall.",https://redd.it/18omgy6,Rd28T,201,29,2023-12-22
